{
  "schema_version": "2.0.0",
  "contract_id": "learnpilot-rag-eval-gold-contract-v2",
  "corpus_ref": {
    "corpus_id": "learnpilot-rag-demo-corpus",
    "corpus_version": "v1"
  },
  "case_count": 48,
  "cases": [
    {
      "case_id": "rag-v1-single-default-chunk-size",
      "question": "LearnPilot 默认按多少字符切块，并保留多少字符重叠？",
      "difficulty": "easy",
      "type": "single_doc_fact",
      "answerable": true,
      "evidence_groups": [
        {
          "evidence_group_id": "eg-01",
          "required": true,
          "any_of_document_ids": [
            "lp-rag-v1-c03"
          ],
          "notes": "V1 expected evidence: lp-rag-v1-c03"
        }
      ],
      "acceptable_supporting_document_ids": [],
      "irrelevant_or_disallowed_document_ids": [],
      "claims": [
        {
          "claim_id": "rag-v1-single-default-chunk-size-claim-01",
          "canonical_claim": "默认 chunk size 是 800 字符",
          "required": true,
          "evidence_group_ids": [
            "eg-01"
          ],
          "evaluation_mode": "NUMERIC_EXACT",
          "notes": "Traceable to V1 key_facts; requirement status reviewed under V2.",
          "deterministic_match": {
            "all_terms": [
              "800"
            ]
          }
        },
        {
          "claim_id": "rag-v1-single-default-chunk-size-claim-02",
          "canonical_claim": "默认 overlap 是 120 字符",
          "required": true,
          "evidence_group_ids": [
            "eg-01"
          ],
          "evaluation_mode": "NUMERIC_EXACT",
          "notes": "Traceable to V1 key_facts; requirement status reviewed under V2.",
          "deterministic_match": {
            "all_terms": [
              "120"
            ]
          }
        }
      ],
      "citation_contract": {
        "required": true,
        "required_evidence_group_ids": [
          "eg-01"
        ],
        "minimum_distinct_documents": 1,
        "forbid_citations": false,
        "notes": "All required evidence groups must be covered; alternatives within a group are equivalent."
      },
      "v1_trace": {
        "expected_document_ids": [
          "lp-rag-v1-c03"
        ],
        "key_facts": [
          "默认 chunk size 是 800 字符",
          "默认 overlap 是 120 字符"
        ],
        "citation_expectations": {
          "required": true,
          "minimum_distinct_documents": 1,
          "must_cite_document_ids": [
            "lp-rag-v1-c03"
          ],
          "forbid_citations": false,
          "notes": "两个配置事实由同一文档直接支持。"
        }
      },
      "gold_review": {
        "status": "REVIEWED",
        "semantics_changed": false,
        "audit_reasons": [],
        "audit_notes": "All claims and evidence roles were checked against the frozen corpus; no semantic Gold change was needed."
      }
    },
    {
      "case_id": "rag-v1-paraphrase-delete-history",
      "question": "如果原资料被移除，之前回答里的证据线索会不会跟着完全消失？",
      "difficulty": "medium",
      "type": "semantic_paraphrase",
      "answerable": true,
      "evidence_groups": [
        {
          "evidence_group_id": "eg-01",
          "required": true,
          "any_of_document_ids": [
            "lp-rag-v1-a03"
          ],
          "notes": "V1 expected evidence: lp-rag-v1-a03"
        }
      ],
      "acceptable_supporting_document_ids": [
        "lp-rag-v1-a04"
      ],
      "irrelevant_or_disallowed_document_ids": [],
      "claims": [
        {
          "claim_id": "rag-v1-paraphrase-delete-history-claim-01",
          "canonical_claim": "删除资料后 citation 的 chunk/material 外键会变为 NULL",
          "required": true,
          "evidence_group_ids": [
            "eg-01"
          ],
          "evaluation_mode": "SEMANTIC_REVIEW",
          "notes": "Traceable to V1 key_facts; requirement status reviewed under V2."
        },
        {
          "claim_id": "rag-v1-paraphrase-delete-history-claim-02",
          "canonical_claim": "历史 citation 的原文件名、位置与正文摘录仍保留",
          "required": true,
          "evidence_group_ids": [
            "eg-01"
          ],
          "evaluation_mode": "SEMANTIC_REVIEW",
          "notes": "Traceable to V1 key_facts; requirement status reviewed under V2."
        }
      ],
      "citation_contract": {
        "required": true,
        "required_evidence_group_ids": [
          "eg-01"
        ],
        "minimum_distinct_documents": 1,
        "forbid_citations": false,
        "notes": "All required evidence groups must be covered; alternatives within a group are equivalent."
      },
      "v1_trace": {
        "expected_document_ids": [
          "lp-rag-v1-a03"
        ],
        "key_facts": [
          "删除资料后 citation 的 chunk/material 外键会变为 NULL",
          "历史 citation 的原文件名、位置与正文摘录仍保留"
        ],
        "citation_expectations": {
          "required": true,
          "minimum_distinct_documents": 1,
          "must_cite_document_ids": [
            "lp-rag-v1-a03"
          ],
          "forbid_citations": false,
          "notes": "问题不复用文档里的删除/快照措辞，用于语义改写命中。"
        }
      },
      "gold_review": {
        "status": "REVIEWED",
        "semantics_changed": true,
        "audit_reasons": [
          "ALTERNATIVE_DOCUMENT_EQUIVALENT"
        ],
        "audit_notes": "Evidence role or evaluation semantics changed for the corpus-grounded reason listed above."
      }
    },
    {
      "case_id": "rag-v1-multidoc-controlled-write",
      "question": "说明 Agent 写操作从计划到真正执行的限制与确认步骤。",
      "difficulty": "hard",
      "type": "multi_doc",
      "answerable": true,
      "evidence_groups": [
        {
          "evidence_group_id": "eg-01",
          "required": true,
          "any_of_document_ids": [
            "lp-rag-v1-b01"
          ],
          "notes": "V1 expected evidence: lp-rag-v1-b01"
        },
        {
          "evidence_group_id": "eg-02",
          "required": true,
          "any_of_document_ids": [
            "lp-rag-v1-b02"
          ],
          "notes": "V1 expected evidence: lp-rag-v1-b02"
        }
      ],
      "acceptable_supporting_document_ids": [
        "lp-rag-v1-b03"
      ],
      "irrelevant_or_disallowed_document_ids": [],
      "claims": [
        {
          "claim_id": "rag-v1-multidoc-controlled-write-claim-01",
          "canonical_claim": "一次运行最多一个写工具且写入前只能先执行读取",
          "required": true,
          "evidence_group_ids": [
            "eg-01"
          ],
          "evaluation_mode": "SEMANTIC_REVIEW",
          "notes": "Traceable to V1 key_facts; requirement status reviewed under V2."
        },
        {
          "claim_id": "rag-v1-multidoc-controlled-write-claim-02",
          "canonical_claim": "写工具参数先被冻结并生成确认记录",
          "required": true,
          "evidence_group_ids": [
            "eg-02"
          ],
          "evaluation_mode": "SEMANTIC_REVIEW",
          "notes": "Traceable to V1 key_facts; requirement status reviewed under V2."
        },
        {
          "claim_id": "rag-v1-multidoc-controlled-write-claim-03",
          "canonical_claim": "真正写入只在用户批准并恢复原运行后发生",
          "required": true,
          "evidence_group_ids": [
            "eg-02"
          ],
          "evaluation_mode": "SEMANTIC_REVIEW",
          "notes": "Traceable to V1 key_facts; requirement status reviewed under V2."
        }
      ],
      "citation_contract": {
        "required": true,
        "required_evidence_group_ids": [
          "eg-01",
          "eg-02"
        ],
        "minimum_distinct_documents": 2,
        "forbid_citations": false,
        "notes": "All required evidence groups must be covered; alternatives within a group are equivalent."
      },
      "v1_trace": {
        "expected_document_ids": [
          "lp-rag-v1-b01",
          "lp-rag-v1-b02"
        ],
        "key_facts": [
          "一次运行最多一个写工具且写入前只能先执行读取",
          "写工具参数先被冻结并生成确认记录",
          "真正写入只在用户批准并恢复原运行后发生"
        ],
        "citation_expectations": {
          "required": true,
          "minimum_distinct_documents": 2,
          "must_cite_document_ids": [
            "lp-rag-v1-b01",
            "lp-rag-v1-b02"
          ],
          "forbid_citations": false,
          "notes": "限额来自 B01，interrupt/resume 与批准后写入来自 B02。"
        }
      },
      "gold_review": {
        "status": "REVIEWED",
        "semantics_changed": true,
        "audit_reasons": [
          "ALTERNATIVE_DOCUMENT_EQUIVALENT"
        ],
        "audit_notes": "Evidence role or evaluation semantics changed for the corpus-grounded reason listed above."
      }
    },
    {
      "case_id": "rag-v1-rerank-candidate-expansion",
      "question": "默认 RAG top_k=6 时，RAG 层会向 MaterialIndexService 请求多少候选？系统是否还会调用独立的 cross-encoder 重排模型？",
      "difficulty": "hard",
      "type": "rerank_disambiguation",
      "answerable": true,
      "evidence_groups": [
        {
          "evidence_group_id": "eg-01",
          "required": true,
          "any_of_document_ids": [
            "lp-rag-v1-a01"
          ],
          "notes": "V1 expected evidence: lp-rag-v1-a01"
        },
        {
          "evidence_group_id": "eg-02",
          "required": true,
          "any_of_document_ids": [
            "lp-rag-v1-a02"
          ],
          "notes": "V1 expected evidence: lp-rag-v1-a02"
        }
      ],
      "acceptable_supporting_document_ids": [],
      "irrelevant_or_disallowed_document_ids": [],
      "claims": [
        {
          "claim_id": "rag-v1-rerank-candidate-expansion-claim-01",
          "canonical_claim": "RAG 层默认向 MaterialIndexService 请求最多 18 个候选",
          "required": true,
          "evidence_group_ids": [
            "eg-02"
          ],
          "evaluation_mode": "NUMERIC_EXACT",
          "notes": "Traceable to V1 key_facts; requirement status reviewed under V2.",
          "deterministic_match": {
            "all_terms": [
              "18"
            ]
          }
        },
        {
          "claim_id": "rag-v1-rerank-candidate-expansion-claim-02",
          "canonical_claim": "运行时没有独立 cross-encoder reranker",